{
  "objectType": "capsule.governed-deno-core.release-candidate-consumption-manifest",
  "schemaVersion": 1,
  "candidateId": "governed-deno-core-linux-arm64-rc-2026-08-04-1",
  "selfDigest": {
    "algorithm": "sha256",
    "normalization": "replace-this-value-with-64-ascii-zeroes-in-the-exact-utf8-file",
    "sha256": "78cf2e99e58a4e79413f22889dd19f794ac7cdce3e4ec5c167d6c2051d19afaa"
  },
  "status": {
    "construction": "PASSED",
    "releasePublication": "BLOCKED",
    "runtimeSelection": "IN_PROGRESS — TRENDING_GOOD",
    "runtimeAdmission": "BLOCKED",
    "runtime001": "unsupported"
  },
  "target": {
    "operatingSystem": "linux",
    "architecture": "arm64",
    "rustTarget": "aarch64-unknown-linux-gnu",
    "objectFormat": "ELF64",
    "endianness": "little",
    "abi": "GNU glibc",
    "minimumAssumptions": {
      "glibc": "2.36-9+deb12u14",
      "libgcc": "12.2.0-14+deb12u1",
      "dynamicLoader": "/lib/ld-linux-aarch64.so.1",
      "explicitLoaderArguments": ["--inhibit-cache", "--library-path", "/lib/aarch64-linux-gnu"],
      "kernelInputsOutsideRoot": ["procfs", "cgroupfs", "/dev/urandom"],
      "substitutionAllowed": false
    }
  },
  "governedSources": {
    "deno": {
      "repository": "https://github.com/Shrimpworks/deno.git",
      "upstreamCommit": "14eea3160ae5834476aa3b9d317b8d41d991b982",
      "upstreamTree": "2732e7fb4f51907ce8a95ac068481c28185a21d2",
      "governedCommits": [
        "8d8c9e56a4972d3a8779799572ea3e818ce84338",
        "a86d5b7c277f5884820b2f1ae498d334b0759dae",
        "1fdc8cea7da481e132c21d4c283e42539ac447eb",
        "aafa35a9ef319dd2422552fe9d5ab2f7e91bb7ec",
        "9adb0b68b55bca81644827f1e7749a3acb091bed"
      ],
      "governedHead": "9adb0b68b55bca81644827f1e7749a3acb091bed",
      "governedTree": "72edd0f7b5f83b918945860653714e344c8a303f",
      "mergeCommit": "ea18b9dc21ff8ebd19347be7095f47937ee14ec2",
      "mergeParents": [
        "14eea3160ae5834476aa3b9d317b8d41d991b982",
        "9adb0b68b55bca81644827f1e7749a3acb091bed"
      ],
      "sourceArchive": {
        "path": "sources/Shrimpworks-deno-source.tar.gz",
        "size": 32342282,
        "sha256": "d117cc1594c9876717deba66a7792c7d5520cdf6379642b412931614b848bd54"
      },
      "workspaceCargoLockSha256": "4dd8f08c8b223adbf3468fce5fe9e0468dfe9f4a255129cc304cb604fa0d389d",
      "physicalOmissionPatchSha256": "f45fda69db3875dbd730aa9568cb88ff6cc35a25c8d82edb5fa3b521c19bac37",
      "deterministicOrderingPatchSha256": "9dd33fd423ce98f030d80eba5cb386d5236b7ca103aa45b58ce5b36125d8061e",
      "restorationMutationSha256": "e0e98557b709437d464464922a3c4d4cc45af1832d32108d584cfe771125ee40",
      "governanceDocumentSha256": "da22a7856b49bc06a1fb4921f1f97eb1c8951d80572ec0f4efcc55d586da8f32",
      "verifierSha256": "a880c599ee538b655c614d7da4111b05e62cb66a9bcca4cd4ddae1cc44c47aaa"
    },
    "rustyV8": {
      "repository": "https://github.com/Shrimpworks/rusty_v8.git",
      "upstreamCommit": "d305e6afa7736f6e298c30ae6646f7709ee9382b",
      "upstreamTree": "e55bc850420d20b1ea2230eef9da6e26c07ef765",
      "governedHead": "80e863ddb942a4aa2b384e794fc23e35b9d2bb15",
      "governedTree": "d8950a7a1ee907761720b23d24eaa9b63aa33b10",
      "mergeCommit": "cbf56de2e1156b1cf1561fdbaea7172a0aa056f4",
      "mergeParents": [
        "eddede228a9214c4dfb6a85aeca22abc0679100d",
        "80e863ddb942a4aa2b384e794fc23e35b9d2bb15"
      ],
      "rejectedTerminalHeads": [
        "17698caedb8721c132a3e2f08f7ab0ae212f313a",
        "a43ee7486c3e05bce5d6e5db586b3e2e688c33cf",
        "c774d71b9b1d0021a5283b07d9185d6ec4d41b95",
        "e21917350e48cc920c9ed1984e671a6bb2113df0"
      ],
      "sourceLockSha256": "df1630e159dfec398ca8d71305431d441b6953efc910de63f4c0e6e28f251855",
      "builderLockSha256": "da45206bfdea87b0dc3ddb9ec31babdce264862174ec30450baddee2d8c1f70b",
      "expectedOutputsSha256": "da5543735995f960bfd1a22489b242e706c8c4a2aa7392c2644004a6e464b17d",
      "recursiveGitlinkCount": 20,
      "v8Commit": "ac1e23989121713ca642f6650b34deff7b686896",
      "v8PatchCount": 4
    }
  },
  "construction": {
    "prefetchNetwork": "connected-declared-digest-pinned-inputs-only",
    "buildTestEvidenceNetwork": "disabled",
    "emptyOutputsAndCaches": true,
    "sourceDateEpoch": 0,
    "locale": "C",
    "timezone": "UTC",
    "workspace": "/workspace",
    "snapshotLogicalCpuCount": 1,
    "snapshotCpuSet": "0",
    "aslr": "disabled-with-setarch-aarch64-R",
    "independentBuilder": false,
    "rustyV8Builder": {
      "image": "docker.io/library/rust@sha256:307d198027388f780db83929487de35084a73ecbaa31319989438db38103439f",
      "indexDigest": "sha256:e187887ec511b3d93e45c0231d2f0fd59f1347526c58aa86343aa83c74f3e1a9",
      "buildPlatform": "linux/amd64",
      "targetPlatform": "linux/arm64",
      "method": "cross-under-Docker-platform-emulation"
    },
    "denoAndRootBuilder": {
      "image": "rust:1.95.0-bookworm@sha256:6258907abe69656e41cd992e0b705cdcfabcbbe3db374f92ed2d47121282d4a1",
      "platformImageId": "sha256:7cf1e580ef5539f03b58560753e8ab84c8c360960d99dff714004aa98f203977",
      "platform": "linux/arm64"
    },
    "toolchain": {
      "denoRustc": "rustc 1.95.0 59807616e1fa2540724bfbac14d7976d7e4a3860",
      "denoCargo": "cargo 1.95.0 f2d3ce0bd7f24a49f8f72d9000448f8838c4e850",
      "denoLlvm": "22.1.2",
      "rustyV8Rustc": "rustc 1.91.0 f8297e351a40c1439a467bbbb6879088047f50b3",
      "rustyV8Cargo": "cargo 1.91.0 ea2d97820c16195b0ca3fadb4319fe512c199a43",
      "rustyV8Llvm": "21.1.2",
      "clangArchiveSha256": "de584381536aa5ba2403033c4f8b70f3c39c2e5d7fa87c953b7fd8bfbba0ee2a",
      "clangRevision": "llvmorg-23-init-10931-g20b6ec66-11",
      "gnInstanceId": "2w75WgzO2nc2UMXt6PDqnK3LCqbHZ-11ME5WIr4hJQQC",
      "gnArchiveSha256": "db0ef95a0cceda773650c5ede8f0ea9cadcb0aa6c767ed75304e5622be212504",
      "ninjaInstanceId": "Px8cwPaaG8_fZ_tsK8dBmx3YEruNDnmvqb-oo1U7UIIC",
      "ninjaArchiveSha256": "3f1f1cc0f69a1bcfdf67fb6c2bc7419b1dd812bb8d0e79afa9bfa8a3553b5082",
      "targetRustStdSha256": "ff23dc81f796d64e34e866a44fd0bcae726e34014835369b8f9393a544167eca",
      "chromiumRustToolchainSha256": "832de79f8d90940f4aaef023f83a00c1e7210c023f4d57f606b7bf9831c889aa",
      "crossPackageCount": 22,
      "crossPackageSnapshot": "https://snapshot.debian.org/archive/debian/20251104T000000Z",
      "cargoSourceBundle": {
        "path": "sources/cargo-source-bundle.tar.gz",
        "size": 70134953,
        "sha256": "1e96e49a516e4cf6a9ec79acae9a9eb3d0ee52b332695fa11476a97e1e50d1d4"
      }
    }
  },
  "runtimeSubjects": [
    {
      "role": "rusty-v8-static-archive-raw",
      "path": "artifacts/librusty_v8_simdutf_release_aarch64-unknown-linux-gnu.a",
      "mediaType": "application/x-archive",
      "size": 184789162,
      "sha256": "e964d6b1b3689e91f8cf488d8a9f05764a03434b2e2e8347be5067300d39a7de"
    },
    {
      "role": "rusty-v8-static-archive-gzip",
      "path": "artifacts/librusty_v8_simdutf_release_aarch64-unknown-linux-gnu.a.gz",
      "mediaType": "application/gzip",
      "size": 37674703,
      "sha256": "1ae209c9e4ba5803d010d2c79ee4cc0af0126c5a7ebcca211c7e41deaede4cd2"
    },
    {
      "role": "deno-core-binary",
      "path": "artifacts/capsule-deno-core-physical-omission",
      "mediaType": "application/x-elf",
      "size": 68497624,
      "sha256": "56d3acefd2cc2f5136a0b8143c47131e49a58fbf66382dfd3e84f715ce8e2898"
    },
    {
      "role": "startup-snapshot",
      "path": "artifacts/capsule_core_snapshot.bin",
      "mediaType": "application/octet-stream",
      "size": 699988,
      "sha256": "4e8965217d5a6675a880326eee6f690bbeec7e7cb243decf2f3e9f453a871a2c"
    },
    {
      "role": "two-file-runtime-bundle",
      "path": "artifacts/capsule-deno-core-runtime-bundle.tar.gz",
      "mediaType": "application/gzip",
      "size": 20983891,
      "sha256": "0cc08f93e82fcfe68b033e8807975a3bd67068a817da811a87a73aedc3f23937"
    },
    {
      "role": "dynamic-root-manifest",
      "path": "artifacts/runtime-root-files.tsv",
      "mediaType": "text/tab-separated-values",
      "size": 1807,
      "sha256": "100832dbb37737f29341bc5404df6d4405b8d6b706f274028892801fa88e7de8"
    },
    {
      "role": "dynamic-root-tar",
      "path": "artifacts/rootfs.tar",
      "mediaType": "application/x-tar",
      "size": 71895040,
      "sha256": "9c46b45c4d220aedcc47c9ee53e875bc71d31d0b881b51740aaa9b882b5741e6"
    },
    {
      "role": "dynamic-root-gzip",
      "path": "artifacts/rootfs.tar.gz",
      "mediaType": "application/gzip",
      "size": 22192615,
      "sha256": "e847651b35cd425dd8f6fe3bd45d693aff0af244e3a7bd30c629fa125cac62e8"
    }
  ],
  "runtimeAuthority": {
    "denoCoreVersion": "0.409.0",
    "extensionRegistry": [],
    "builtinOps": [
      "op_get_ext_import_meta_proto",
      "op_get_extras_binding_object",
      "op_set_captured_bootstrap"
    ],
    "finalLinkStatementSha256": "18793b423311e8e6a906cf4572d343ee33406c2c228343c42b6d85665c134429",
    "moduleLoader": "none",
    "v8Flags": ["--jitless", "--random-seed=42"],
    "exactStatement": "the ordered registry and final linked deno_core binary contain exactly the three named bootstrap ops; zero extra, missing, renamed, or restored ops are permitted"
  },
  "dynamicRoot": {
    "entryCount": 22,
    "regularFileBytes": 71871210,
    "typeCounts": { "directory": 11, "file": 10, "symlink": 1 },
    "modeCounts": { "directory-0755": 11, "file-0644": 8, "file-0755": 2, "symlink-0755": 1 },
    "orderedEntryManifestSha256": "100832dbb37737f29341bc5404df6d4405b8d6b706f274028892801fa88e7de8",
    "loaderAndLibraries": [
      {
        "path": "lib/aarch64-linux-gnu/ld-linux-aarch64.so.1",
        "mode": "0755",
        "size": 202912,
        "sha256": "17538b8f9889a470c061f69a8fea8124da89627311cd16546c133a89f09056df",
        "binaryPackage": "libc6_2.36-9+deb12u14_arm64.deb"
      },
      {
        "path": "lib/ld-linux-aarch64.so.1",
        "mode": "0755",
        "type": "symlink",